{
  "entity_registry": {
    "org:gelesis_holdings_inc": {
      "kind": "organization",
      "canonical_name": "Gelesis Holdings Inc",
      "aliases": []
    },
    "org:b_riley_principal_capital_ii_llc": {
      "kind": "organization",
      "canonical_name": "B. Riley Principal Capital II, LLC",
      "aliases": [
        "B Riley",
        "B Riley Principal Capital II LLC",
        "B. Riley"
      ]
    }
  },
  "block_registry": {
    "1.01.block.0": {
      "id": "1.01.block.0",
      "type": "structural",
      "paragraph_ids": [
        "1.01.p1",
        "1.01.p8"
      ],
      "semantic_role": "structural"
    },
    "1.01.block.1": {
      "id": "1.01.block.1",
      "type": "pricing_mechanism",
      "paragraph_ids": [
        "1.01.p2",
        "1.01.p3",
        "1.01.p4",
        "1.01.p7"
      ],
      "semantic_role": "pricing",
      "pricing_model": {
        "type": "vwap_discount",
        "method": "VWAP",
        "modes": [
          {
            "name": "regular_purchase",
            "vwap_window": "full_session",
            "discount_percent": 3,
            "volume_threshold_truncation": true,
            "excludes_open_close": true
          },
          {
            "name": "intraday_purchase",
            "vwap_window": "intraday_segments",
            "multi_window": true,
            "discount_percent": 3
          }
        ]
      }
    },
    "1.01.block.2": {
      "id": "1.01.block.2",
      "type": "constraint",
      "paragraph_ids": [
        "1.01.p5",
        "1.01.p6"
      ],
      "semantic_role": "constraint"
    },
    "1.01.block.3": {
      "id": "1.01.block.3",
      "type": "termination",
      "paragraph_ids": [
        "1.01.p9"
      ],
      "semantic_role": "termination"
    },
    "1.01.block.4": {
      "id": "1.01.block.4",
      "type": "regulatory_disclosure",
      "paragraph_ids": [
        "1.01.p10",
        "1.01.p11"
      ],
      "semantic_role": "disclosure"
    },
    "3.02.block.0": {
      "id": "3.02.block.0",
      "type": "structural",
      "paragraph_ids": [
        "3.02.p1"
      ],
      "semantic_role": "structural"
    },
    "9.01.block.0": {
      "id": "9.01.block.0",
      "type": "structural",
      "paragraph_ids": [
        "9.01.p1"
      ],
      "semantic_role": "structural"
    },
    "signature.block.0": {
      "id": "signature.block.0",
      "type": "structural",
      "paragraph_ids": [
        "signature.p1"
      ],
      "semantic_role": "structural"
    }
  },
  "events": [
    {
      "id": "event:agreement_execution_1.01.p1",
      "kind": "agreement_execution",
      "label": "Item 1.01 Entry into a Material Definitive Agreement. On August 11, 2022, Gelesis Holdings, Inc. (the “Company”) entered into a Common Stock Purchase Agreement ",
      "primary_entity_id": "org:gelesis_holdings_inc",
      "counterparty_entity_ids": [
        "org:b_riley_principal_capital_ii_llc"
      ],
      "agreement_types": [
        "Common Stock Purchase Agreement",
        "Registration Rights Agreement"
      ],
      "source_block_ids": [
        "1.01.block.0"
      ],
      "as_of_date": "2022-08-11"
    },
    {
      "id": "event:termination_1_01_block_3",
      "kind": "agreement_termination",
      "label": "The Purchase Agreement will automatically terminate on the earliest to occur of (i) the first day of the month following the 24-month anniversary of the Commencement Date, (ii) the date on which B. Riley shall have purchased from the Company under the Purchase Agreement shares of Common Stock for an aggregate gross purchase price of $50,000,000, (iii) the date on which the Common Stock shall have failed to be listed ",
      "primary_entity_id": "org:gelesis_holdings_inc",
      "counterparty_entity_ids": [
        "org:b_riley_principal_capital_ii_llc"
      ],
      "agreement_types": [
        "Common Stock Purchase Agreement",
        "Registration Rights Agreement"
      ],
      "source_block_ids": [
        "1.01.block.3"
      ]
    }
  ],
  "relationships": [
    {
      "type": "defines",
      "source": "1.01.block.1",
      "target": "org:b_riley_principal_capital_ii_llc"
    },
    {
      "type": "governs",
      "source": "1.01.block.1",
      "target": "1.01.p2"
    },
    {
      "type": "governs",
      "source": "1.01.block.1",
      "target": "1.01.p3"
    },
    {
      "type": "governs",
      "source": "1.01.block.1",
      "target": "1.01.p4"
    },
    {
      "type": "governs",
      "source": "1.01.block.1",
      "target": "1.01.p7"
    },
    {
      "type": "governs",
      "source": "1.01.block.2",
      "target": "1.01.p5"
    },
    {
      "type": "governs",
      "source": "1.01.block.2",
      "target": "1.01.p6"
    },
    {
      "type": "constrains",
      "source": "1.01.block.2",
      "target": "org:gelesis_holdings_inc"
    },
    {
      "type": "constrains",
      "source": "1.01.block.2",
      "target": "org:b_riley_principal_capital_ii_llc"
    },
    {
      "type": "governs",
      "source": "1.01.block.3",
      "target": "1.01.p9"
    },
    {
      "type": "triggers",
      "source": "1.01.block.3",
      "target": "event:termination_1_01_block_3"
    },
    {
      "type": "references",
      "source": "3.02.block.0",
      "target": "1.01.p1"
    },
    {
      "type": "triggers",
      "source": "1.01.block.0",
      "target": "event:agreement_execution_1.01.p1"
    },
    {
      "type": "governs",
      "source": "1.01.block.0",
      "target": "1.01.p1"
    },
    {
      "type": "governs",
      "source": "1.01.block.0",
      "target": "1.01.p8"
    },
    {
      "type": "governs",
      "source": "1.01.block.4",
      "target": "1.01.p10"
    },
    {
      "type": "governs",
      "source": "1.01.block.4",
      "target": "1.01.p11"
    },
    {
      "type": "governs",
      "source": "3.02.block.0",
      "target": "3.02.p1"
    },
    {
      "type": "governs",
      "source": "9.01.block.0",
      "target": "9.01.p1"
    },
    {
      "type": "governs",
      "source": "signature.block.0",
      "target": "signature.p1"
    }
  ],
  "sections": [
    {
      "id": "header",
      "title": "",
      "type": "metadata",
      "text": "",
      "filingHeader": {
        "metadata": {
          "commission_form_version": null
        },
        "company": {
          "name": null,
          "jurisdiction": null,
          "commission_file_number": null,
          "cik": null,
          "irs_employer_id": "84-4730610"
        },
        "filing_info": {
          "form_type": "8-K",
          "filing_date_iso": null
        },
        "securities": [],
        "checkboxes": [
          {
            "id": "cb_0",
            "label": "Written communications pursuant to Rule 425 under the Securities Act (17 CFR 230.425)",
            "checked": false
          },
          {
            "id": "cb_1",
            "label": "Soliciting material pursuant to Rule 14a-12 under the Exchange Act (17 CFR 240.14a-12)",
            "checked": false
          },
          {
            "id": "cb_2",
            "label": "Pre-commencement communications pursuant to Rule 14d-2(b) under the Exchange Act (17 CFR 240.14d-2(b))",
            "checked": false
          },
          {
            "id": "cb_3",
            "label": "Pre-commencement communications pursuant to Rule 13e-4(c) under the Exchange Act (17 CFR 240.13e-4(c))",
            "checked": false
          }
        ],
        "address": "Boston, Massachusetts 02116 (Address of Principal Executive Offices) (Zip Code)",
        "contact_info": "Registrant’s Telephone Number, Including Area Code: 617 456-4718 (Former Name or Former Address, if Changed Since Last Report)",
        "other_filing_notes": null
      },
      "children": []
    },
    {
      "id": "1.01",
      "title": "Entry into a Material Definitive Agreement.",
      "type": "section",
      "text": "",
      "children": [
        {
          "id": "1.01.p1",
          "title": "",
          "type": "paragraph",